    ESP SPI: 0x00000047 (71)
    ESP SPI: 0x00000052 (82)
    ESP SPI: 0x00000042 (66)
    ESP SPI: 0x00000044 (68)
    ESP SPI: 0x00000049 (73)
    ESP SPI: 0x0000004e (78)
    ESP SPI: 0x0000004a (74)
    ESP SPI: 0x00000056 (86)
    ESP SPI: 0x00000048 (72)
    ESP SPI: 0x00000045 (69)
    ESP SPI: 0x0000005a (90)
    ESP SPI: 0x00000055 (85)
    ESP SPI: 0x00000043 (67)
    ESP SPI: 0x0000004d (77)
    ESP SPI: 0x0000005a (90)
    ESP SPI: 0x00000059 (89)
    ESP SPI: 0x00000047 (71)
    ESP SPI: 0x00000059 (89)
    ESP SPI: 0x00000034 (52)
    ESP SPI: 0x00000044 (68)
    ESP SPI: 0x0000004d (77)
    ESP SPI: 0x00000051 (81)
    ESP SPI: 0x0000004a (74)
    ESP SPI: 0x00000057 (87)
    ESP SPI: 0x00000047 (71)
    ESP SPI: 0x00000051 (81)
    ESP SPI: 0x00000033 (51)
    ESP SPI: 0x00000045 (69)
    ESP SPI: 0x00000043 (67)
    ESP SPI: 0x0000004d (77)
    ESP SPI: 0x0000005a (90)
    ESP SPI: 0x00000052 (82)
    ESP SPI: 0x00000047 (71)
    ESP SPI: 0x0000004d (77)
    ESP SPI: 0x0000005a (90)
    ESP SPI: 0x00000044 (68)
    ESP SPI: 0x00000047 (71)
    ESP SPI: 0x0000004d (77)
    ESP SPI: 0x0000005a (90)
    ESP SPI: 0x00000054 (84)
    ESP SPI: 0x00000048 (72)
    ESP SPI: 0x00000045 (69)
    ESP SPI: 0x00000033 (51)
    ESP SPI: 0x00000044 (68)
    ESP SPI: 0x00000053 (83)
    ESP SPI: 0x0000004e (78)
    ESP SPI: 0x00000053 (83)
    ESP SPI: 0x00000042 (66)
    ESP SPI: 0x00000047 (71)
    ESP SPI: 0x00000059 (89)
    ESP SPI: 0x00000059 (89)
    ESP SPI: 0x00000054 (84)
    ESP SPI: 0x0000004d (77)
    ESP SPI: 0x0000004e (78)
    ESP SPI: 0x00000052 (82)
    ESP SPI: 0x00000057 (87)
    ESP SPI: 0x00000047 (71)
    ESP SPI: 0x00000051 (81)
    ESP SPI: 0x00000033 (51)
    ESP SPI: 0x00000045 (69)
    ESP SPI: 0x00000045 (69)
    ESP SPI: 0x0000004e (78)
    ESP SPI: 0x00000052 (82)
    ESP SPI: 0x00000052 (82)
    ESP SPI: 0x00000047 (71)
    ESP SPI: 0x00000034 (52)
    ESP SPI: 0x0000005a (90)
    ESP SPI: 0x00000054 (84)
    ESP SPI: 0x0000004d (77)
    ESP SPI: 0x0000004e (78)
    ESP SPI: 0x00000042 (66)
    ESP SPI: 0x00000054 (84)
    ESP SPI: 0x00000047 (71)
    ESP SPI: 0x00000051 (81)
    ESP SPI: 0x0000005a (90)
    ESP SPI: 0x00000054 (84)
    ESP SPI: 0x00000053 (83)
    ESP SPI: 0x0000004e (78)
    ESP SPI: 0x0000005a (90)
    ESP SPI: 0x00000051 (81)
    ESP SPI: 0x00000047 (71)
    ESP SPI: 0x00000059 (89)
    ESP SPI: 0x00000059 (89)
    ESP SPI: 0x00000054 (84)
    ESP SPI: 0x00000047 (71)
    ESP SPI: 0x0000004d (77)
    ESP SPI: 0x00000042 (66)
    ESP SPI: 0x00000054 (84)
    ESP SPI: 0x00000047 (71)
    ESP SPI: 0x00000051 (81)
    ESP SPI: 0x00000033 (51)
    ESP SPI: 0x00000044 (68)
    ESP SPI: 0x00000043 (67)
    ESP SPI: 0x0000004e (78)
    ESP SPI: 0x00000052 (82)
    ESP SPI: 0x00000055 (85)
    ESP SPI: 0x00000047 (71)
    ESP SPI: 0x0000005a (90)
    ESP SPI: 0x00000042 (66)
    ESP SPI: 0x00000044 (68)
    ESP SPI: 0x00000047 (71)
    ESP SPI: 0x0000004d (77)
    ESP SPI: 0x0000005a (90)
    ESP SPI: 0x00000058 (88)
    ESP SPI: 0x00000047 (71)
    ESP SPI: 0x0000004d (77)
    ESP SPI: 0x00000033 (51)
    ESP SPI: 0x00000044 (68)
    ESP SPI: 0x00000047 (71)
    ESP SPI: 0x0000004e (78)
    ESP SPI: 0x00000052 (82)
    ESP SPI: 0x00000052 (82)
    ESP SPI: 0x00000047 (71)
    ESP SPI: 0x0000004d (77)
    ESP SPI: 0x00000032 (50)
    ESP SPI: 0x00000041 (65)
    ESP SPI: 0x0000003d (61)
    ESP SPI: 0x0000003d (61)
    ESP SPI: 0x0000003d (61)
    ESP SPI: 0x0000003d (61)
    ESP SPI: 0x00000047 (71)
    ESP SPI: 0x00000052 (82)
    ESP SPI: 0x00000042 (66)
    ESP SPI: 0x00000044 (68)
    ESP SPI: 0x00000049 (73)
    ESP SPI: 0x0000004e (78)
    ESP SPI: 0x0000004a (74)
    ESP SPI: 0x00000056 (86)
    ESP SPI: 0x00000048 (72)
    ESP SPI: 0x00000045 (69)
    ESP SPI: 0x0000005a (90)
    ESP SPI: 0x00000055 (85)
    ESP SPI: 0x00000043 (67)
    ESP SPI: 0x0000004d (77)
    ESP SPI: 0x0000005a (90)
    ESP SPI: 0x00000059 (89)
    ESP SPI: 0x00000047 (71)
    ESP SPI: 0x00000059 (89)
    ESP SPI: 0x00000034 (52)
    ESP SPI: 0x00000044 (68)
    ESP SPI: 0x0000004d (77)
    ESP SPI: 0x00000051 (81)
    ESP SPI: 0x0000004a (74)
    ESP SPI: 0x00000057 (87)
    ESP SPI: 0x00000047 (71)
    ESP SPI: 0x00000051 (81)
    ESP SPI: 0x00000033 (51)
    ESP SPI: 0x00000045 (69)
    ESP SPI: 0x00000043 (67)
    ESP SPI: 0x0000004d (77)
    ESP SPI: 0x0000005a (90)
    ESP SPI: 0x00000052 (82)
    ESP SPI: 0x00000047 (71)
    ESP SPI: 0x0000004d (77)
    ESP SPI: 0x0000005a (90)
    ESP SPI: 0x00000044 (68)
    ESP SPI: 0x00000047 (71)
    ESP SPI: 0x0000004d (77)
    ESP SPI: 0x0000005a (90)
    ESP SPI: 0x00000054 (84)
    ESP SPI: 0x00000048 (72)
    ESP SPI: 0x00000045 (69)
    ESP SPI: 0x00000033 (51)
    ESP SPI: 0x00000044 (68)
    ESP SPI: 0x00000053 (83)
    ESP SPI: 0x0000004e (78)
    ESP SPI: 0x00000053 (83)
    ESP SPI: 0x00000042 (66)
    ESP SPI: 0x00000047 (71)
    ESP SPI: 0x00000059 (89)
    ESP SPI: 0x00000059 (89)
    ESP SPI: 0x00000054 (84)
    ESP SPI: 0x0000004d (77)
    ESP SPI: 0x0000004e (78)
    ESP SPI: 0x00000052 (82)
    ESP SPI: 0x00000057 (87)
    ESP SPI: 0x00000047 (71)
    ESP SPI: 0x00000051 (81)
    ESP SPI: 0x00000033 (51)
    ESP SPI: 0x00000045 (69)
    ESP SPI: 0x00000045 (69)
    ESP SPI: 0x0000004e (78)
    ESP SPI: 0x00000052 (82)
    ESP SPI: 0x00000052 (82)
    ESP SPI: 0x00000047 (71)
    ESP SPI: 0x00000034 (52)
    ESP SPI: 0x0000005a (90)
    ESP SPI: 0x00000054 (84)
    ESP SPI: 0x0000004d (77)
    ESP SPI: 0x0000004e (78)
    ESP SPI: 0x00000042 (66)
    ESP SPI: 0x00000054 (84)
    ESP SPI: 0x00000047 (71)
    ESP SPI: 0x00000051 (81)
    ESP SPI: 0x0000005a (90)
    ESP SPI: 0x00000054 (84)
    ESP SPI: 0x00000053 (83)
    ESP SPI: 0x0000004e (78)
    ESP SPI: 0x0000005a (90)
    ESP SPI: 0x00000051 (81)
    ESP SPI: 0x00000047 (71)
    ESP SPI: 0x00000059 (89)
    ESP SPI: 0x00000059 (89)
    ESP SPI: 0x00000054 (84)
    ESP SPI: 0x00000047 (71)
    ESP SPI: 0x0000004d (77)
    ESP SPI: 0x00000042 (66)
    ESP SPI: 0x00000054 (84)
    ESP SPI: 0x00000047 (71)
    ESP SPI: 0x00000051 (81)
    ESP SPI: 0x00000033 (51)
    ESP SPI: 0x00000044 (68)
    ESP SPI: 0x00000043 (67)
    ESP SPI: 0x0000004e (78)
    ESP SPI: 0x00000052 (82)
    ESP SPI: 0x00000055 (85)
    ESP SPI: 0x00000047 (71)
    ESP SPI: 0x0000005a (90)
    ESP SPI: 0x00000042 (66)
    ESP SPI: 0x00000044 (68)
    ESP SPI: 0x00000047 (71)
    ESP SPI: 0x0000004d (77)
    ESP SPI: 0x0000005a (90)
    ESP SPI: 0x00000058 (88)
    ESP SPI: 0x00000047 (71)
    ESP SPI: 0x0000004d (77)
    ESP SPI: 0x00000033 (51)
    ESP SPI: 0x00000044 (68)
    ESP SPI: 0x00000047 (71)
    ESP SPI: 0x00000047 (71)
    ESP SPI: 0x0000004e (78)
    ESP SPI: 0x00000052 (82)
    ESP SPI: 0x00000052 (82)
    ESP SPI: 0x00000047 (71)
    ESP SPI: 0x0000004d (77)
    ESP SPI: 0x00000032 (50)
    ESP SPI: 0x00000041 (65)
    ESP SPI: 0x0000003d (61)
    ESP SPI: 0x0000003d (61)
    ESP SPI: 0x0000003d (61)
    ESP SPI: 0x0000003d (61)
    ESP SPI: 0x00000047 (71)
    ESP SPI: 0x00000052 (82)
    ESP SPI: 0x00000042 (66)
    ESP SPI: 0x00000044 (68)
    ESP SPI: 0x00000049 (73)
    ESP SPI: 0x0000004e (78)
    ESP SPI: 0x0000004a (74)
    ESP SPI: 0x00000056 (86)
    ESP SPI: 0x00000048 (72)
    ESP SPI: 0x00000045 (69)
    ESP SPI: 0x0000005a (90)
    ESP SPI: 0x00000055 (85)
    ESP SPI: 0x00000043 (67)
    ESP SPI: 0x0000004d (77)
    ESP SPI: 0x0000005a (90)
    ESP SPI: 0x00000059 (89)
    ESP SPI: 0x00000047 (71)
    ESP SPI: 0x00000059 (89)
    ESP SPI: 0x00000034 (52)
    ESP SPI: 0x00000044 (68)
    ESP SPI: 0x0000004d (77)
    ESP SPI: 0x00000051 (81)
    ESP SPI: 0x0000004a (74)
    ESP SPI: 0x00000057 (87)
    ESP SPI: 0x00000047 (71)
    ESP SPI: 0x00000051 (81)
    ESP SPI: 0x00000033 (51)
    ESP SPI: 0x00000045 (69)
    ESP SPI: 0x00000043 (67)
    ESP SPI: 0x0000004d (77)
    ESP SPI: 0x0000005a (90)
    ESP SPI: 0x00000052 (82)
    ESP SPI: 0x00000047 (71)
    ESP SPI: 0x0000004d (77)
    ESP SPI: 0x0000005a (90)
    ESP SPI: 0x00000044 (68)
    ESP SPI: 0x00000047 (71)
    ESP SPI: 0x0000004d (77)
    ESP SPI: 0x0000005a (90)
    ESP SPI: 0x00000054 (84)
    ESP SPI: 0x00000048 (72)
    ESP SPI: 0x00000045 (69)
    ESP SPI: 0x00000033 (51)
    ESP SPI: 0x00000044 (68)
    ESP SPI: 0x00000053 (83)
    ESP SPI: 0x0000004e (78)
    ESP SPI: 0x00000053 (83)
    ESP SPI: 0x00000042 (66)
    ESP SPI: 0x00000047 (71)
    ESP SPI: 0x00000059 (89)
    ESP SPI: 0x00000059 (89)
    ESP SPI: 0x00000054 (84)
    ESP SPI: 0x0000004d (77)
    ESP SPI: 0x0000004e (78)
    ESP SPI: 0x00000052 (82)
    ESP SPI: 0x00000057 (87)
    ESP SPI: 0x00000047 (71)
    ESP SPI: 0x00000051 (81)
    ESP SPI: 0x00000033 (51)
    ESP SPI: 0x00000045 (69)
    ESP SPI: 0x00000045 (69)
    ESP SPI: 0x0000004e (78)
    ESP SPI: 0x00000052 (82)
    ESP SPI: 0x00000052 (82)
    ESP SPI: 0x00000047 (71)
    ESP SPI: 0x00000034 (52)
    ESP SPI: 0x0000005a (90)
    ESP SPI: 0x00000054 (84)
    ESP SPI: 0x0000004d (77)
    ESP SPI: 0x0000004e (78)
    ESP SPI: 0x00000042 (66)
    ESP SPI: 0x00000054 (84)
    ESP SPI: 0x00000047 (71)
    ESP SPI: 0x00000051 (81)
    ESP SPI: 0x0000005a (90)
    ESP SPI: 0x00000054 (84)
    ESP SPI: 0x00000053 (83)
    ESP SPI: 0x0000004e (78)
    ESP SPI: 0x0000005a (90)
    ESP SPI: 0x00000051 (81)
    ESP SPI: 0x00000047 (71)
    ESP SPI: 0x00000059 (89)
    ESP SPI: 0x00000059 (89)
    ESP SPI: 0x00000054 (84)
    ESP SPI: 0x00000047 (71)
    ESP SPI: 0x0000004d (77)
    ESP SPI: 0x00000042 (66)
    ESP SPI: 0x00000054 (84)
    ESP SPI: 0x00000047 (71)
    ESP SPI: 0x00000051 (81)
    ESP SPI: 0x00000033 (51)
    ESP SPI: 0x00000044 (68)
    ESP SPI: 0x00000043 (67)
    ESP SPI: 0x0000004e (78)
    ESP SPI: 0x00000052 (82)
    ESP SPI: 0x00000055 (85)
    ESP SPI: 0x00000047 (71)
    ESP SPI: 0x0000005a (90)
    ESP SPI: 0x00000042 (66)
    ESP SPI: 0x00000044 (68)
    ESP SPI: 0x00000047 (71)
    ESP SPI: 0x0000004d (77)
    ESP SPI: 0x0000005a (90)
    ESP SPI: 0x00000058 (88)
    ESP SPI: 0x00000047 (71)
    ESP SPI: 0x0000004d (77)
    ESP SPI: 0x00000033 (51)
    ESP SPI: 0x00000044 (68)
    ESP SPI: 0x00000047 (71)
    ESP SPI: 0x0000004e (78)
    ESP SPI: 0x00000052 (82)
    ESP SPI: 0x00000052 (82)
    ESP SPI: 0x00000047 (71)
    ESP SPI: 0x0000004d (77)
    ESP SPI: 0x00000032 (50)
    ESP SPI: 0x00000041 (65)
